{
  "eventId": "01J2ZK4G8QTEN4NTCRE4TED001",
  "eventType": "identity.tenant_created.v1",
  "schemaVersion": 1,
  "tenantId": "0f3a1c2e-7b4d-4e5f-8a9b-1c2d3e4f5a6b",
  "farmId": null,
  "aggregateType": "tenant",
  "aggregateId": "0f3a1c2e-7b4d-4e5f-8a9b-1c2d3e4f5a6b",
  "aggregateVersion": 1,
  "occurredAt": "2026-07-22T12:00:00.000Z",
  "recordedAt": "2026-07-22T12:00:00.128Z",
  "actor": {
    "type": "user",
    "id": "9a8b7c6d-5e4f-4a3b-8c2d-1e0f9a8b7c6d",
    "display": "SAGA Administration"
  },
  "source": {
    "channel": "api",
    "deviceId": null,
    "appVersion": "admin-cli/0.1.0"
  },
  "correlationId": "3d2c1b0a-9f8e-4d7c-8b6a-5f4e3d2c1b0a",
  "causationId": null,
  "idempotencyKey": "register-tenant-agropecuaria-boa-vista-2026-07-22",
  "payload": {
    "name": "Agropecuária Boa Vista Ltda",
    "defaultLocale": "pt-BR",
    "defaultCurrency": "BRL"
  },
  "metadata": {
    "locale": "pt-BR",
    "qualityFlags": [],
    "supersedesEventId": null
  }
}
