{
  "eventId": "01J2ZK4G8QMEMBER4CT1V00001",
  "eventType": "identity.membership_activated.v1",
  "schemaVersion": 1,
  "tenantId": "0f3a1c2e-7b4d-4e5f-8a9b-1c2d3e4f5a6b",
  "farmId": null,
  "aggregateType": "user",
  "aggregateId": "6d5c4b3a-2f1e-4d0c-9b8a-7f6e5d4c3b2a",
  "aggregateVersion": 2,
  "occurredAt": "2026-07-22T14:30:00.000Z",
  "recordedAt": "2026-07-22T14:30:00.201Z",
  "actor": {
    "type": "user",
    "id": "6d5c4b3a-2f1e-4d0c-9b8a-7f6e5d4c3b2a",
    "display": "Maria Souza"
  },
  "source": {
    "channel": "web",
    "deviceId": null,
    "appVersion": "web/0.1.0"
  },
  "correlationId": "1a2b3c4d-5e6f-4a7b-8c9d-0e1f2a3b4c5d",
  "causationId": "01J2ZK4G8QVSERNV1TED000001",
  "idempotencyKey": "activate-membership-maria-souza-boavista-2026-07-22",
  "payload": {
    "userId": "6d5c4b3a-2f1e-4d0c-9b8a-7f6e5d4c3b2a",
    "role": "farm_manager"
  },
  "metadata": {
    "locale": "pt-BR",
    "qualityFlags": [],
    "supersedesEventId": null
  }
}
