{
  "eventId": "01J2ZK4G8QF4RMCRE4TED21001",
  "eventType": "reporting.report_generated.v1",
  "schemaVersion": 1,
  "tenantId": "0f3a1c2e-7b4d-4e5f-8a9b-1c2d3e4f5a6b",
  "farmId": null,
  "aggregateType": "report_run",
  "aggregateId": "b2c3d4e5-6f70-4a1b-8c2d-3e4f5a6b7c8d",
  "aggregateVersion": 1,
  "occurredAt": "2026-07-27T13:40:00.000Z",
  "recordedAt": "2026-07-27T13:40:00.180Z",
  "actor": {
    "type": "user",
    "id": "4b3a2c1d-0e9f-4a8b-9c7d-6e5f4a3b2c1d",
    "display": "Carlos Junqueira"
  },
  "source": {
    "channel": "api",
    "deviceId": null,
    "appVersion": "web/0.1.0"
  },
  "correlationId": "8e7d6c5b-4a3f-4e2d-9c1b-0a9f8e7d6c5b",
  "causationId": null,
  "idempotencyKey": "report-run-b2c3d4e5-6f70-4a1b-8c2d-3e4f5a6b7c8d",
  "payload": {
    "reportKey": "finance.pl",
    "rowCount": 12,
    "checksum": "3b1c9f0a2d4e6f8a0b1c2d3e4f5a6b7c8d9e0f1a2b3c4d5e6f708192a3b4c5d6e"
  },
  "metadata": {
    "locale": "pt-BR",
    "qualityFlags": [],
    "supersedesEventId": null
  }
}
