{
  "eventId": "01J2ZK4G8QF4RMCRE4TED00001",
  "eventType": "identity.farm_created.v1",
  "schemaVersion": 1,
  "tenantId": "0f3a1c2e-7b4d-4e5f-8a9b-1c2d3e4f5a6b",
  "farmId": "7c9e4d2a-51b6-4f3e-9d8c-2b1a0f9e8d7c",
  "aggregateType": "farm",
  "aggregateId": "7c9e4d2a-51b6-4f3e-9d8c-2b1a0f9e8d7c",
  "aggregateVersion": 1,
  "occurredAt": "2026-07-22T12:05:00.000Z",
  "recordedAt": "2026-07-22T12:05:00.310Z",
  "actor": {
    "type": "user",
    "id": "4b3a2c1d-0e9f-4a8b-9c7d-6e5f4a3b2c1d",
    "display": "Carlos Junqueira"
  },
  "source": {
    "channel": "web",
    "deviceId": null,
    "appVersion": "web/0.1.0"
  },
  "correlationId": "8e7d6c5b-4a3f-4e2d-9c1b-0a9f8e7d6c5b",
  "causationId": null,
  "idempotencyKey": "create-farm-fazenda-boa-vista-2026-07-22",
  "payload": {
    "name": "Fazenda Boa Vista",
    "timezone": "America/Campo_Grande",
    "areaHa": 1250.5
  },
  "metadata": {
    "locale": "pt-BR",
    "qualityFlags": [],
    "supersedesEventId": null
  }
}
